{
  "accession_id": "csg-fava-broadwindsor-001",
  "common_name": "Fava Bean",
  "scientific_name": "Vicia faba",
  "cultivar_or_landrace": "Broad Windsor",
  "plant_family": "Fabaceae",
  "origin_notes": "Maintained in local stewardship collection.",
  "bioregion_id": "cascadia-willamette",
  "steward_status": "active",
  "adaptation_notes": "Showing useful performance under local spring conditions.",
  "pollination_notes": "Monitor pollinator activity during flowering.",
  "storage_notes": "Cool dry storage in sealed container.",
  "related_accessions": []
}
